index,published,keyword,domain,language,valid,title,description,url,image,archive,content,quote
bc7ffd4201667fa62878bfb4f8977149,2025-11-02T06:29:52Z,'Nebel Wetter',www.zeit.de,de,1,"Wetter: Regenschirm, Sonne-Comeback, Nebel: So wird das Wetter","Hier finden Sie Informationen zu dem Thema „Wetter“. Lesen Sie jetzt „Regenschirm, Sonne-Comeback, Nebel: So wird das Wetter“.",https://www.zeit.de/news/2025-11/02/regenschirm-sonne-comeback-nebel-so-wird-das-wetter,https://img.zeit.de/news/2025-11/02/regenschirm-sonne-comeback-nebel-so-wird-das-wetter-image-group/wide__1300x731,,"Wer zu Allerseelen einen Spaziergang etwa zum Friedhof plant, sollte sich wappnen: Nach Angaben des Deutschen Wetterdienstes (DWD) regnet es vor allem im Süden und Südosten Baden-Württembergs - teils… [+1109 chars]",
8e7da4737df785edaf8aa4e0dd54fb70,2025-11-02T06:29:52Z,'Nebel Wetter',www.stern.de,de,1,"Wetter: Regenschirm, Sonne-Comeback, Nebel: So wird das Wetter","Stuttgart (lsw) - Wer zu Allerseelen einen Spaziergang etwa zum Friedhof plant, sollte sich wappnen: Nach Angaben des Deutschen Wetterdienstes (DWD)",https://www.stern.de/gesellschaft/regional/baden-wuerttemberg/wetter--regenschirm--sonne-comeback--nebel--so-wird-das-wetter-36181534.html,https://image.stern.de/36181536/t/k8/v1/w1440/r1.7778/-/02--glrkhggmpav6axs2048jpeg---75b8c8fdca377555.jpg,,"Kopiere den aktuellen Link
Zur Merkliste hinzufügen
Allerseelen bringt passendes Trauerwetter: graue Wolken und viel Regen. Zum Wochenbeginn aber ändert sich das.
Wer zu Allerseelen einen Spazierg… [+1235 chars]",
bd6b9e4a01590c6d027632ed8977ea32,2025-11-02T11:52:19Z,'Nebel Wetter',www.diepresse.com,de,1,Herbst bringt Sonne und milde Temperaturen,"In den kommenden Tagen stellt sich in Österreich typisches Herbstwetter ein: Hochdruckeinfluss sorgt für ruhiges und meist sonniges Wetter, mit häufigem Nebel und milden Temperaturen. Gegen Ende der Woche werden die Hochnebelfelder hartnäckiger – Regen bleibt…",https://www.diepresse.com/20264249/hochdruckeinfluss-sorgt-fuer-ruhiges-herbstwetter,https://img.diepresse.com/public/incoming/h4oezv-imago-images-0839126243/alternates/DPR_SOCIAL_NACHRICHTEN/imago%20images%200839126243,,"In den kommenden Tagen stellt sich in Österreich typisches Herbstwetter ein: Hochdruckeinfluss sorgt für ruhiges und meist sonniges Wetter, mit häufigem Nebel und milden Temperaturen. Gegen Ende der … [+2436 chars]",
2412d3375c6599973697b3dba1a515cb,2025-11-02T12:50:35Z,'Nebel Wetter',www.stern.de,de,1,"Wetter: 20,4 Grad in Garmisch zum Beginn der Herbstferien","Sonne in den Bergen, Nebel in den Tälern: In den Herbstferien breitet sich in Bayern ein Hochdruckgebiet aus. Der Deutsche Wetterdienst erwartet freundliches und schönes Wetter.",https://www.stern.de/gesellschaft/regional/bayern/wetter--20-4-grad-in-garmisch-zum-beginn-der-herbstferien-36182076.html,https://image.stern.de/36182078/t/fB/v1/w1440/r1.7778/-/02--j6aftytaryv4axs2048jpeg---4b3ae1f981d2f757.jpg,,"Kopiere den aktuellen Link
Zur Merkliste hinzufügen
Sonne in den Bergen, Nebel in den Tälern: In den Herbstferien breitet sich in Bayern ein Hochdruckgebiet aus. Der Deutsche Wetterdienst erwartet … [+1635 chars]",
8ffc358d593884ff4c764614ed54223d,2025-11-02T14:03:22Z,'Nebel Wetter',www.n-tv.de,de,1,"Wetterwoche im Schnellcheck: Hurrikan ""Melissa"" mischt beim deutschen Wetter mit","Die erste Novemberwoche startet typisch für November - mit Regen. Doch das bleibt die Ausnahme. Freundliches Wetter setzt sich durch, mit Sonne und milden Temperaturen. Nur vereinzelt ziehen Schauer, Nebel oder kräftige Winde auf. Ab Donnerstag schwächt das H…",https://www.n-tv.de/panorama/Hurrikan-Melissa-mischt-beim-deutschen-Wetter-mit-article26135974.html,https://www.n-tv.de/img/incoming/crop26136007/6941329877-cImg_16_9-w1200/555679868.jpg,,"Die erste Novemberwoche startet typisch für November - mit Regen. Doch das bleibt die Ausnahme. Freundliches Wetter setzt sich durch, mit Sonne und milden Temperaturen. Nur vereinzelt ziehen Schauer,… [+3162 chars]",
5f6019a969ea6aab0d22094547af9d8e,2025-11-04T05:01:26Z,'Nebel Wetter',www.stern.de,de,1,"DWD-Prognose: Neblig, trocken, sonnig – Herbst zeigt sich freundlich","Wenn das kein Wetter für Spaziergänge ist: Nebel sorgt für mystische Morgenstunden, tagsüber bringt die Sonne Lichtblicke – typisch für die Übergangszeit zwischen Herbst und Winter.",https://www.stern.de/gesellschaft/regional/baden-wuerttemberg/dwd-prognose--neblig--trocken--sonnig---herbst-zeigt-sich-freundlich-36186164.html,https://image.stern.de/36186166/t/pZ/v1/w1440/r1.7778/-/04--pnnw5miuduv5axs2048jpeg---88c6e466f5f2eefd.jpg,,"Kopiere den aktuellen Link
Zur Merkliste hinzufügen
Wenn das kein Wetter für Spaziergänge ist: Nebel sorgt für mystische Morgenstunden, tagsüber bringt die Sonne Lichtblicke typisch für die Übergan… [+895 chars]",
90f08a7bf6256b47f5631e5286293a48,2025-11-05T06:18:05Z,'Nebel Sichtweite',www.zeit.de,de,1,Prognose: Bayerns Wetter: Wo Nebel bleibt und wo die Sonne scheint,Hier finden Sie Informationen zu dem Thema „Prognose“. Lesen Sie jetzt „Bayerns Wetter: Wo Nebel bleibt und wo die Sonne scheint“.,https://www.zeit.de/news/2025-11/05/bayerns-wetter-wo-nebel-bleibt-und-wo-die-sonne-scheint,https://img.zeit.de/news/2025-11/05/bayerns-wetter-wo-nebel-bleibt-und-wo-die-sonne-scheint-image-group/wide__1300x731,,"Vor allem nebelig werden die nächsten Tage in Bayern. Gerade Autofahrer müssen aufpassen, denn die Sichtweite liegt teilweise unter 150 Metern. Doch wenn sich der Nebel verzieht, kommt laut Deutschem… [+1058 chars]",
d877697a7754ec87b791c1c619b3d56c,2025-11-05T06:18:05Z,'Nebel Wetter',www.stern.de,de,1,Prognose: Bayerns Wetter: Wo Nebel bleibt und wo die Sonne scheint,"Zwischen Donau-Nebel oder Alpen-Sonne: Ist der Nebel mal weg, steigen auch die Temperaturen. Wer jetzt auf Sonnenschein hoffen darf, verrät der Ausblick.",https://www.stern.de/gesellschaft/regional/bayern/prognose--bayerns-wetter--wo-nebel-bleibt-und-wo-die-sonne-scheint-36189870.html,https://image.stern.de/36189872/t/tS/v1/w1440/r1.7778/-/05--gbaehhzx2cv6axs2048jpeg---33b4b6b8a19c0264.jpg,,"Kopiere den aktuellen Link
Zur Merkliste hinzufügen
Zwischen Donau-Nebel oder Alpen-Sonne: Ist der Nebel mal weg, steigen auch die Temperaturen. Wer jetzt auf Sonnenschein hoffen darf, verrät der A… [+1227 chars]",
c50cb76e1c978848a319b9681622a1ee,2025-11-07T13:45:00Z,'Nebel Sichtweite',www.gamestar.de,de,1,Deals: CPU-Bundle mit Top-Game - Dein Prozessor gehört ins Altersheim? Beim Kauf dieser CPU gibt es Battlefield 6 dazu [Anzeige],"Das ist kein Nebel, das ist mangelnde Sichtweite: Zeit für ein CPU Upgrade inklusive kostenlosem Battlefield 6!","https://www.gamestar.de/artikel/intel-core-ultra-gratis-battlefield-6-amazon,3442603.html",https://images.cgames.de/images/gamestar/293/intel-core-ultra-x-bf6-titel_6384950.jpg,,"Intel versucht mit neuen Game-Bundles die AMD-Dominanz bei Gamingprozessoren ein wenig zu bändigen. Vielleicht überzeugt euch die Gratis-Beilage ja tatsächlich vom Kauf eines Core Ultra.
Der PC brau… [+4347 chars]",
