index,published,keyword,domain,language,valid,title,description,url,image,archive,content,quote,de,en,la,added
12f31842e22e33bc5647bb137c4878a1,2025-12-02T07:29:21Z,'Nebel Wetter',www.stern.de,de,0.8,"Wetterprognose: Frost, Nebel und Glätte – Wetter bleibt winterlich","Offenbach (lrs) - Die Menschen in Rheinland-Pfalz und im Saarland müssen sich in den kommenden Tagen und Nächten auf Frost, Nebel und vereinzelt auch",https://www.stern.de/gesellschaft/regional/rheinland-pfalz-saarland/wetterprognose--frost--nebel-und-glaette---wetter-bleibt-winterlich-36918224.html,https://image.stern.de/36918226/t/Rn/v1/w1440/r1.7778/-/02--qd7o4l7pduv6axs2048jpeg---c10162b0a3bb92e5.jpg,,"Kopiere den aktuellen Link
Zur Merkliste hinzufügen
Frostige Kälte, Glättegefahr, Nebel und Regen: Das Wetter in Rheinland-Pfalz und im Saarland wird in den nächsten Tagen und Nächten ungemütlich.… [+879 chars]",,"Wetterprognose: Frost, Nebel und Glätte – Wetter bleibt winterlich. Offenbach (lrs) - Die Menschen in Rheinland-Pfalz und im Saarland müssen sich in den kommenden Tagen und Nächten auf Frost, Nebel und vereinzelt auch","Weather forecast: Frost, fog and slippery weather – the weather remains wintry. Offenbach (lrs) - People in Rhineland-Palatinate and Saarland will have to prepare for frost, fog and in some cases in the coming days and nights","Tempestas praenuntietur: Pruina, nebula et lubrica tempestas - tempestas hiemalis manet. Offenbach (lrs) - Homines in Rheno-Palatinatu et Saarlandia gelu, nebulam et alicubi in diebus ac noctibus venientes praeparare debebunt.",2025-12-10 07:40:43+00:00
dafb535730bb18834b0dfacadd77a3c5,2025-12-03T05:00:59Z,'Nebel Wetter',www.tagesspiegel.de,de,0.8,Wetter: Frost in Berlin und Brandenburg,Das Wetter in Berlin und Brandenburg bleibt frostig. Der Deutsche Wetterdienst rechnet auch mit Nebel und Glätte.,https://www.tagesspiegel.de/berlin/wetter-frost-in-berlin-und-brandenburg-15009465.html,https://www.tagesspiegel.de/images/15009464/alternates/BASE_16_9_W1400/1764738059000/frost-in-brandenburg.jpeg,,Es wird wieder frostig in Berlin und Brandenburg. Nach Angaben des Deutschen Wetterdienstes (DWD) startet der Tag bewölkt und nebelig. Bis in den Vormittag hinein sei mit Temperaturen bis minus 3 Gra… [+553 chars],,Wetter: Frost in Berlin und Brandenburg. Das Wetter in Berlin und Brandenburg bleibt frostig. Der Deutsche Wetterdienst rechnet auch mit Nebel und Glätte.,Weather: Frost in Berlin and Brandenburg. The weather in Berlin and Brandenburg remains frosty. The German Weather Service also expects fog and slippery conditions.,Weather: Frost in Berlin and Brandenburg. Tempestas in Berlin et Brandenburg gelida manet. Ministerium Tempestatis Germanorum etiam nebulam et lubricas condiciones exspectat.,2025-12-10 07:40:43+00:00
0deab460a4db15447025c6c4dee94399,2025-12-03T10:32:43Z,'Nebel Wetter',www.bild.de,de,0.8,"Glätte, Gewitter und Sturm - Wetterdienst warnt vor gefährlicher Woche",Der Deutsche Wetterdienst warnt vor Glätte und Nebel. Am Wochenende kommen Gewitter mit Graupel sowie Sturmböen dazu.,https://www.bild.de/news/inland/glaette-gewitter-und-sturm-wetterdienst-warnt-vor-gefaehrlicher-woche-692fe6d734f148f9c6046308,"https://images.bild.de/692fe6d734f148f9c6046308/edf0ff77da3229dfbaa9368c28942db7,ce7e9ded?w=1280",,Offenbach (Hessen) Dieser Herbst bringt uns winterliche Glätte auf den Straßen. Vor allem im Osten und Süden warnt der Deutsche Wetterdienst (DWD) vor Frost und gebietsweise überfrierendem Regen. Zud… [+2307 chars],,"Glätte, Gewitter und Sturm - Wetterdienst warnt vor gefährlicher Woche. Der Deutsche Wetterdienst warnt vor Glätte und Nebel. Am Wochenende kommen Gewitter mit Graupel sowie Sturmböen dazu.","Slippery weather, thunderstorms and storms - the weather service warns of a dangerous week. The German Weather Service warns of slippery conditions and fog. This weekend there will be thunderstorms with sleet and squalls.","Tempestas lubrica, tonitribus, procellis - ser- mones tempestatum periculosas hebdomades. Ministerium Tempestatis Germanorum monet condiciones lubricas et nebulas. Volutpat haec erunt procellis cum pruina et procellis.",2025-12-10 07:40:43+00:00
4f0dca0d0845c5190e83180db431eedf,2025-12-08T06:03:43Z,'Nebel Wetter',www.zeit.de,de,0.8,Tiefdruckgebiet: Regen und Nebel – Wetter in Hessen bleibt unbeständig,Hier finden Sie Informationen zu dem Thema „Tiefdruckgebiet“. Lesen Sie jetzt „Regen und Nebel – Wetter in Hessen bleibt unbeständig“.,https://www.zeit.de/news/2025-12/08/regen-und-nebel-wetter-in-hessen-bleibt-unbestaendig,https://img.zeit.de/news/2025-12/08/regen-und-nebel-wetter-in-hessen-bleibt-unbestaendig-image-group/wide__1300x731,,"Ein Tiefdruckgebiet sorgt in Hessen für wechselhaftes Wetter. Laut dem Deutschen Wetterdienst (DWD) ist der Himmel am Montag stark bewölkt, stellenweise regnet es. Die Temperaturen sind mild bei 12 b… [+497 chars]",,Tiefdruckgebiet: Regen und Nebel – Wetter in Hessen bleibt unbeständig. Hier finden Sie Informationen zu dem Thema „Tiefdruckgebiet“. Lesen Sie jetzt „Regen und Nebel – Wetter in Hessen bleibt unbeständig“.,Low pressure area: rain and fog – the weather in Hesse remains unstable. Here you will find information on the topic of “low pressure areas”. Read now “Rain and fog – the weather in Hesse remains unstable”.,"Area pressa humilis: pluvia et nebula - tempestas in Hassia instabilis manet. Hic informationes invenies in argumento ""pressionis humilitatis areae"". Lege nunc ""Imber et nebula - tempestas in Hassia instabilis manet"".",2025-12-11 07:40:46+00:00
c563a2fffc36dca2e55aad87f66ec0a5,2025-12-08T06:03:43Z,'Nebel Wetter',www.stern.de,de,0.8,Tiefdruckgebiet: Regen und Nebel – Wetter in Hessen bleibt unbeständig,Offenbach/Main (lhe) - Ein Tiefdruckgebiet sorgt in Hessen für wechselhaftes Wetter. Laut dem Deutschen Wetterdienst (DWD) ist der Himmel am Montag stark,https://www.stern.de/gesellschaft/regional/hessen/tiefdruckgebiet--regen-und-nebel---wetter-in-hessen-bleibt-unbestaendig-36938416.html,https://image.stern.de/36938418/t/nJ/v1/w1440/r1.7778/-/08--f4nes5bnyfv12axs2048jpeg---0a573c23dc817b63.jpg,,"Kopiere den aktuellen Link
Zur Merkliste hinzufügen
Die Woche beginnt in Hessen mit Wolken und Regen. Die Temperaturen bleiben mild. Am Dienstag wird es neblig.
Ein Tiefdruckgebiet sorgt in Hessen… [+621 chars]",,Tiefdruckgebiet: Regen und Nebel – Wetter in Hessen bleibt unbeständig. Offenbach/Main (lhe) - Ein Tiefdruckgebiet sorgt in Hessen für wechselhaftes Wetter. Laut dem Deutschen Wetterdienst (DWD) ist der Himmel am Montag stark,"Low pressure area: rain and fog – the weather in Hesse remains unstable. Offenbach/Main (lhe) - A low pressure area is causing changeable weather in Hesse. According to the German Weather Service (DWD), the sky will be strong on Monday","Area pressa humilis: pluvia et nebula - tempestas in Hassia instabilis manet. Offenbach/Main (lhe) - Humilis pressionis regio in Hassia mutabiles tempestates causat. Secundum Germanorum Tempestatem Service (DWD), caelum erit fortis die Lunae",2025-12-11 07:40:46+00:00
858549a169b0340644fc6ed261568461,2025-12-08T09:26:00Z,'Nebel Wetter',www.faz.net,de,0.8,Rhein-Main-Liveblog: Unbekannte stehlen Reisebus für mehr als 300.000 Euro,Fahrerflucht in Wettenberg: Frau wird angefahren und schwer verletzt +++ Seligenstadt: Unbekannte schmieren Hakenkreuze an Kirchenwand +++ Regen und Nebel – Wetter in Hessen bleibt unbeständig +++ Liveblog zu Rhein-Main und Hessen,https://www.faz.net/aktuell/rhein-main/unbekannte-stehlen-reisebus-in-nidderau-aktuelle-nachrichten-aus-frankfurt-hessen-faz-19735361.html,https://media0.faz.net/image/w1200h627/a4cb3250c018/w3000h1567x0y216o/202512/c2085be4-1782-4f1e-97d2-7f4f72a62546/die-polizei-hat-erste-hinweise.webp,,"Entlassene Staatssekretärin: 
Vorwürfe gegen Messari-Becker erhärtet
 Der Untersuchungsausschuss zur Abberufung der hessischen Staatssekretärin  hat ihr sehr geschadet, der Opposition auch: Für die… [+121 chars]",,Rhein-Main-Liveblog: Unbekannte stehlen Reisebus für mehr als 300.000 Euro. Fahrerflucht in Wettenberg: Frau wird angefahren und schwer verletzt +++ Seligenstadt: Unbekannte schmieren Hakenkreuze an Kirchenwand +++ Regen und Nebel – Wetter in Hessen bleibt unbeständig +++ Liveblog zu Rhein-Main und Hessen,"Rhein-Main live blog: Unknown people steal a coach for more than 300,000 euros. Hit-and-run in Wettenberg: Woman is hit and seriously injured +++ Seligenstadt: Unknown people smear swastikas on church wall +++ Rain and fog - weather in Hesse remains unstable +++ Live blog about Rhine-Main and Hesse","Rhein-Main blog vivant: Ignoti homines raeda plus quam 300.000 nummorum surripiunt. Hit-and-currunt in Wettenberg: Mulier percussa est et graviter laesa +++ Seligenstadt: homines ignoti swastikas in muro ecclesiae +++ Pluviae et nebulae oblinunt, tempestates in Hassia instabiles manet +++ Vive blog circa Rhenum-Main et Hassiam.",2025-12-11 07:40:46+00:00
3e76625ea248378dc14cc1783a86942f,2025-12-04T05:07:57Z,'Nebel Vorhersage',www.tagesspiegel.de,de,0.8,Wetteraussichten: Frostiger Start in den Tag in Berlin und Brandenburg,"Kühler Beginn, später Wolken und Nebel: So wird das Wetter in Berlin und Brandenburg.",https://www.tagesspiegel.de/berlin/wetteraussichten-frostiger-start-in-den-tag-in-berlin-und-brandenburg-15014874.html,https://www.tagesspiegel.de/images/15014873/alternates/BASE_16_9_W1400/1764824877000/morgenstimmung-in-brandenburg.jpeg,,"In Berlin und Brandenburg ist am Donnerstag mit überwiegend trockenem Wetter zu rechnen. Nach Angaben des Deutschen Wetterdienstes (DWD) starten beide Bundesländer frostig in den Tag, örtlich mit Tem… [+702 chars]",,"Wetteraussichten: Frostiger Start in den Tag in Berlin und Brandenburg. Kühler Beginn, später Wolken und Nebel: So wird das Wetter in Berlin und Brandenburg.","Weather outlook: Frosty start to the day in Berlin and Brandenburg. Cool start, later clouds and fog: This is what the weather will be like in Berlin and Brandenburg.","Tempestas prospectans: Frosty initium est diei Berolini et Brandenburgici. Initium frigus, postea nubes et nebula: haec tempestas erit in Berlin et Brandenburg.",2025-12-11 13:54:04+00:00
017e873c9742f34b1cee0b4d2699d269,2025-12-04T05:53:40Z,'Nebel Vorhersage',www.zeit.de,de,0.8,"Wetter: Regen, Nebel und Glätte in Hessen erwartet","Hier finden Sie Informationen zu dem Thema „Wetter“. Lesen Sie jetzt „Regen, Nebel und Glätte in Hessen erwartet“.",https://www.zeit.de/news/2025-12/04/regen-nebel-und-glaette-in-hessen-erwartet,https://img.zeit.de/news/2025-12/04/regen-nebel-und-glaette-in-hessen-erwartet-image-group/wide__1300x731,,"Auf winterliches Grau, Regen und frostige Nächte müssen sich Menschen in Hessen in den nächsten Tagen einstellen. Erst ab dem Wochenende sollen die Temperaturen laut dem Deutschem Wetterdienst (DWD) … [+1079 chars]",,"Wetter: Regen, Nebel und Glätte in Hessen erwartet. Hier finden Sie Informationen zu dem Thema „Wetter“. Lesen Sie jetzt „Regen, Nebel und Glätte in Hessen erwartet“.","Weather: Rain, fog and slippery conditions expected in Hesse. Here you will find information on the topic of “weather”. Read now “Rain, fog and slippery conditions expected in Hesse”.","Tempestas: Pluvia, nebula et lubrica condiciones in Hassia expectatae sunt. Hic informationes invenies in argumento ""tempestatis"". Lege nunc ""pluvia, nebula et lubrica condiciones in Hassia expectatae"".",2025-12-11 13:54:04+00:00
d5389dbcf6f28c3ba17ff30b28339798,2025-12-10T05:03:09Z,'Nebel Vorhersage',www.stern.de,de,0.8,"Vorhersage: Nebel, Wolken und kaum Regen im Südwesten","Stuttgart (lsw) - Bis zum Wochenende erwarten die Menschen in Baden-Württemberg Wolken, Nebel, aber kaum Regen. Bis dahin gehen laut einem Sprecher des",https://www.stern.de/gesellschaft/regional/baden-wuerttemberg/vorhersage--nebel--wolken-und-kaum-regen-im-suedwesten-36945936.html,https://image.stern.de/36945938/t/E3/v1/w1440/r1.7778/-/10--sa6j3ox7dev6axs2048jpeg---4c04a4b0328302be.jpg,,"Kopiere den aktuellen Link
Zur Merkliste hinzufügen
Ade Sonne, hallo Nebel. Der Deutsche Wetterdienst spricht von vielen Wolken und kühlerer Luft - aber kaum Regen in Baden-Württemberg.
Bis zum Wo… [+990 chars]",,"Vorhersage: Nebel, Wolken und kaum Regen im Südwesten. Stuttgart (lsw) - Bis zum Wochenende erwarten die Menschen in Baden-Württemberg Wolken, Nebel, aber kaum Regen. Bis dahin gehen laut einem Sprecher des","Forecast: Fog, clouds and hardly any rain in the southwest. Stuttgart (lsw) - People in Baden-Württemberg are expecting clouds, fog, but hardly any rain until the weekend. Until then, according to a spokesman for the","Praedictio: Nebula, nubes, et fere ullus pluviae in africum. Stuttgart (lsw) - Homines in Baden-Württemberg nubes nebulas exspectant, sed vix ullam pluviam usque ad volutpat. Hucusque, secundum prolocutor",2025-12-11 13:54:04+00:00
f45ff55b73cb421ffe8941e3ff7ab934,2025-12-10T05:03:09Z,'Nebel Vorhersage',www.zeit.de,de,0.8,"Vorhersage: Nebel, Wolken und kaum Regen im Südwesten","Hier finden Sie Informationen zu dem Thema „Vorhersage“. Lesen Sie jetzt „Nebel, Wolken und kaum Regen im Südwesten“.",https://www.zeit.de/news/2025-12/10/nebel-wolken-und-kaum-regen-im-suedwesten,https://img.zeit.de/news/2025-12/10/nebel-wolken-und-kaum-regen-im-suedwesten-image-group/wide__1300x731,,"Bis zum Wochenende erwarten die Menschen in Baden-Württemberg Wolken, Nebel, aber kaum Regen. Bis dahin gehen laut einem Sprecher des Deutschen Wetterdienstes (DWD) die Temperaturen wieder zurück. Di… [+840 chars]",,"Vorhersage: Nebel, Wolken und kaum Regen im Südwesten. Hier finden Sie Informationen zu dem Thema „Vorhersage“. Lesen Sie jetzt „Nebel, Wolken und kaum Regen im Südwesten“.","Forecast: Fog, clouds and hardly any rain in the southwest. Here you will find information on the topic of “prediction”. Now read “Fog, clouds and hardly any rain in the southwest”.","Praedictio: Nebula, nubes, et fere ullus pluviae in africum. Hic informationes invenies in argumento ""praedictionis"". Nunc legitur ""Nebula, nubes, et vix ullus pluvia in Africo"".",2025-12-11 13:54:04+00:00
34ff51acc2fbb6152ca9d6740e146aff,2025-12-11T05:49:57Z,'Nebel Wetter',www.zeit.de,de,0.8,"Wetterbericht: Nebelscheinwerfer an: Wo es trüb bleibt, wo es sonnig wird","Hier finden Sie Informationen zu dem Thema „Wetterbericht“. Lesen Sie jetzt „Nebelscheinwerfer an: Wo es trüb bleibt, wo es sonnig wird“.",https://www.zeit.de/news/2025-12/11/nebelscheinwerfer-an-wo-es-trueb-bleibt-wo-es-sonnig-wird,https://img.zeit.de/news/2025-12/11/nebelscheinwerfer-an-wo-es-trueb-bleibt-wo-es-sonnig-wird-image-group/wide__1300x731,,"Das Wetter ist aktuell eher ein Fall für Schal und Nebelscheinwerfer - wer im Südwesten unterwegs ist, sollte sich auf trübe Aussichten und kühle Temperaturen einstellen. Der Deutsche Wetterdienst (D… [+1791 chars]",,"Wetterbericht: Nebelscheinwerfer an: Wo es trüb bleibt, wo es sonnig wird. Hier finden Sie Informationen zu dem Thema „Wetterbericht“. Lesen Sie jetzt „Nebelscheinwerfer an: Wo es trüb bleibt, wo es sonnig wird“.","Weather report: Fog lights on: Where it stays cloudy, where it gets sunny. Here you will find information on the topic of “weather reports”. Now read “Fog lights on: Where it stays cloudy, where it gets sunny”.","Tempestas fama: Nebula lumina in: Ubi nubilum manet, ubi serenum est. Hic informationes invenies in argumento ""tempestatis relationum"". Nunc legitur ""Fog luminaria in: Ubi nubilum manet, ubi serenum est"".",2025-12-12 13:50:30+00:00
fab67c75e0aaaa270e0c33717788a06e,2025-12-11T05:40:22Z,'Nebel Vorhersage',www.stern.de,de,0.8,Milde Temperaturen: Trübes Wetter mit Nebel in Hessen,Offenbach (lhe) - In Hessen bleibt es laut Vorhersage des Deutschen Wetterdienstes (DWD) am Donnerstag länger neblig. Es soll auch tagsüber eher trüb und,https://www.stern.de/gesellschaft/regional/hessen/milde-temperaturen--truebes-wetter-mit-nebel-in-hessen-36950196.html,https://image.stern.de/36950198/t/ez/v1/w1440/r1.7778/-/11--nyn7lnedg7v6axs2048jpeg---bf34b9f41ad83c76.jpg,,"Kopiere den aktuellen Link
Zur Merkliste hinzufügen
Auch am Donnerstag bleibt es in Hessen mild. Allerdings können am Morgen dichtere Nebelfelder aufziehen.
In Hessen bleibt es laut Vorhersage des… [+718 chars]",,Milde Temperaturen: Trübes Wetter mit Nebel in Hessen. Offenbach (lhe) - In Hessen bleibt es laut Vorhersage des Deutschen Wetterdienstes (DWD) am Donnerstag länger neblig. Es soll auch tagsüber eher trüb und,"Mild temperatures: Cloudy weather with fog in Hesse. Offenbach (lhe) - According to the German Weather Service (DWD) forecast, it will remain foggy for a longer period of time in Hesse on Thursday. It should also be rather cloudy and cloudy during the day",Temperaturae mites: Serena tempestas cum nebula in Hassia. Offenbach (lhe) - Secundum praenuntiationem Tempestatis Germanicae (DWD) nebulosus diutius in Hassia manebit die Iovis. Debet etiam esse interdiu magis nubilum et nubilum,2025-12-12 19:33:36+00:00
3bf38ada3212497d7edc9f1f97b87f73,2025-12-11T06:46:39Z,'Nebel Vorhersage',www.stern.de,de,0.8,Wetter-Aussichten: Milde Temperaturen und Nebel im Südwesten,"Nebel, Wolken und milde Temperaturen bestimmen das Wetter in Rheinland-Pfalz und dem Saarland in den kommenden Tagen. Am Samstag kann es dazu regnen.",https://www.stern.de/gesellschaft/regional/rheinland-pfalz-saarland/wetter-aussichten--milde-temperaturen-und-nebel-im-suedwesten-36950398.html,https://image.stern.de/36950400/t/v2/v1/w1440/r1.7778/-/11--b5rxmv3otdv5axs2048jpeg---ee958c752d3d191f.jpg,,"Kopiere den aktuellen Link
Zur Merkliste hinzufügen
Nebel, Wolken und milde Temperaturen bestimmen das Wetter in Rheinland-Pfalz und dem Saarland in den kommenden Tagen. Am Samstag kann es dazu reg… [+576 chars]",,"Wetter-Aussichten: Milde Temperaturen und Nebel im Südwesten. Nebel, Wolken und milde Temperaturen bestimmen das Wetter in Rheinland-Pfalz und dem Saarland in den kommenden Tagen. Am Samstag kann es dazu regnen.","Weather outlook: Mild temperatures and fog in the southwest. Fog, clouds and mild temperatures will determine the weather in Rhineland-Palatinate and Saarland in the coming days. It may rain on Saturday.","Tempestas prospectans: temperaturas mitis et nebula in Africo. Nebula, nubes et temperaturae lenis tempestatem in Rheno-Palatinate et Saarland in diebus proximis determinant. Saturni die pluat.",2025-12-12 19:33:36+00:00
520ef8cfb9d8ea82d8edb62299f6e20f,2025-12-11T06:56:44Z,'Nebel Vorhersage',www.stern.de,de,0.8,Wetter: Trübes und graues Wetter in Bayern,Dichter Nebel und trübe Aussichten bestimmen das Wetter im Freistaat bis zum Wochenende. Wo dennoch Chancen auf Sonne bestehen und wo Frost und Glätte drohen.,https://www.stern.de/gesellschaft/regional/bayern/wetter--truebes-und-graues-wetter-in-bayern-36950402.html,https://image.stern.de/36950404/t/L-/v1/w1440/r1.7778/-/11--aoxaqqoypzv5axs2048jpeg---9e1b91b36cb8ce0d.jpg,,"Kopiere den aktuellen Link
Zur Merkliste hinzufügen
Dichter Nebel und trübe Aussichten bestimmen das Wetter im Freistaat bis zum Wochenende. Wo dennoch Chancen auf Sonne bestehen und wo Frost und G… [+1451 chars]",,Wetter: Trübes und graues Wetter in Bayern. Dichter Nebel und trübe Aussichten bestimmen das Wetter im Freistaat bis zum Wochenende. Wo dennoch Chancen auf Sonne bestehen und wo Frost und Glätte drohen.,Weather: Cloudy and gray weather in Bavaria. Dense fog and cloudy prospects will dominate the weather in the Free State until the weekend. Where there is still a chance of sunshine and where frost and slippery conditions threaten.,Tempestas: Serena et senium in Bavaria. Prospectus densa ac nebulosus in liberae rei publicae tempestatibus dominabitur usque ad volutpat vestibulum. Ubi etiamnum facultas solis et ubi pruinae et lubricae conditiones minantur.,2025-12-12 19:33:36+00:00
a27b5d957b77b64cbc7a527b2ae5a13a,2025-12-12T06:09:23Z,'Nebel Vorhersage',www.stern.de,de,0.8,Vorhersage: Trübes Wetter in Hessen in den kommenden Tagen,Offenbach (lhe) - Nebel und milde Temperaturen erwartetet die Menschen heute in Hessen. Der Nebel löst sich dem Deutschen Wetterdienst in Offenbach,https://www.stern.de/gesellschaft/regional/hessen/vorhersage--truebes-wetter-in-hessen-in-den-kommenden-tagen-36954640.html,https://image.stern.de/36954642/t/CS/v1/w1440/r1.7778/-/12--mdvnc55hewv4axs2048jpeg---d4bc15af2020387e.jpg,,"Kopiere den aktuellen Link
Zur Merkliste hinzufügen
Das Wetter bleibt, wie es ist. Es wird nebelig bei milden Temperaturen.
Nebel und milde Temperaturen erwartetet die Menschen heute in Hessen. De… [+769 chars]",,Vorhersage: Trübes Wetter in Hessen in den kommenden Tagen. Offenbach (lhe) - Nebel und milde Temperaturen erwartetet die Menschen heute in Hessen. Der Nebel löst sich dem Deutschen Wetterdienst in Offenbach,Forecast: Cloudy weather in Hesse in the coming days. Offenbach (lhe) - Fog and mild temperatures awaited people in Hesse today. The fog is clearing at the German Weather Service in Offenbach,Weather: Partialiter Nubila. Offenbach (lhe) - Caligo et temperatura lenis hodie in Hassia homines exspectant. Caligo purgatur apud Officium Tempestatis Germanicae in Offenbach,2025-12-14 19:30:41+00:00
9cda3a9be56d693846ba16dbff1d1361,2025-12-11T05:40:22Z,'Nebel Vorhersage',www.zeit.de,de,0.8,Milde Temperaturen: Trübes Wetter mit Nebel in Hessen,Hier finden Sie Informationen zu dem Thema „Milde Temperaturen“. Lesen Sie jetzt „Trübes Wetter mit Nebel in Hessen“.,https://www.zeit.de/news/2025-12/11/truebes-wetter-mit-nebel-in-hessen,https://img.zeit.de/news/2025-12/11/truebes-wetter-mit-nebel-in-hessen-image-group/wide__1300x731,,In Hessen bleibt es laut Vorhersage des Deutschen Wetterdienstes (DWD) am Donnerstag länger neblig. Es soll auch tagsüber eher trüb und stark bewölkt bleiben. Die Höchstwerte liegen zwischen acht und… [+598 chars],,Milde Temperaturen: Trübes Wetter mit Nebel in Hessen. Hier finden Sie Informationen zu dem Thema „Milde Temperaturen“. Lesen Sie jetzt „Trübes Wetter mit Nebel in Hessen“.,Mild temperatures: Cloudy weather with fog in Hesse. Here you will find information on the topic of “mild temperatures”. Now read “Cloudy weather with fog in Hesse”.,"Temperaturae mites: Serena tempestas cum nebula in Hassia. Hic informationes invenies in argumento ""mitis temperaturis"". Nunc legitur ""Nubila tempestas cum nebula in Hassia"".",2025-12-15 03:52:26+00:00
71751f926dc4133d7fc6d76a4a1a71eb,2025-12-11T06:46:39Z,'Nebel Vorhersage',www.zeit.de,de,0.8,Wetter-Aussichten: Milde Temperaturen und Nebel im Südwesten,Hier finden Sie Informationen zu dem Thema „Wetter-Aussichten“. Lesen Sie jetzt „Milde Temperaturen und Nebel im Südwesten“.,https://www.zeit.de/news/2025-12/11/milde-temperaturen-und-nebel-im-suedwesten,https://img.zeit.de/news/2025-12/11/milde-temperaturen-und-nebel-im-suedwesten-image-group/wide__1300x731,,Auch in den kommenden Tagen bleibt es im Saarland und in Rheinland-Pfalz weiter mild. Dabei kann am Donnerstag laut Vorhersage des Deutschen Wetterdienst (DWD) dichterer Nebel aufziehen. Die Temperat… [+411 chars],,Wetter-Aussichten: Milde Temperaturen und Nebel im Südwesten. Hier finden Sie Informationen zu dem Thema „Wetter-Aussichten“. Lesen Sie jetzt „Milde Temperaturen und Nebel im Südwesten“.,Weather outlook: Mild temperatures and fog in the southwest. Here you will find information on the topic of “weather prospects”. Read “Mild temperatures and fog in the southwest” now.,"Tempestas prospectans: temperaturas mitis et nebula in Africo. Hic informationes invenies in argumento ""prospectus tempestatis"". Lege ""mitis temperaturae et nebulae in Africo"" nunc.",2025-12-15 03:52:26+00:00
e5d732cca2492348fc5cf91377776a49,2025-12-12T06:31:17Z,'Nebel Wetter',www.stern.de,de,0.8,Aussichten: Wolken und Nebel in NRW,Essen (lnw) - Neblig-trüb mit wenigen Aufheiterungen präsentiert sich das Wetter in Nordrhein-Westfalen zum dritten Adventswochenende. Nach regionaler,https://www.stern.de/gesellschaft/regional/nordrhein-westfalen/aussichten--wolken-und-nebel-in-nrw-36954674.html,https://image.stern.de/36954676/t/vF/v1/w1440/r1.7778/-/12--f3wz2bqjcgv6axs2048jpeg---ae42458919ca35a4.jpg,,"Kopiere den aktuellen Link
Zur Merkliste hinzufügen
Trübe Aussichten für NRW: Nebel, Wolken, kaum Sonne. Doch in den Hochlagen blitzt das Licht durch.
Neblig-trüb mit wenigen Aufheiterungen präsen… [+558 chars]",,Aussichten: Wolken und Nebel in NRW. Essen (lnw) - Neblig-trüb mit wenigen Aufheiterungen präsentiert sich das Wetter in Nordrhein-Westfalen zum dritten Adventswochenende. Nach regionaler,Outlook: clouds and fog in NRW. Essen (lnw) - The weather in North Rhine-Westphalia is foggy and cloudy with few signs of cheer for the third weekend in Advent. According to regional,Outlook: nubes et nebula in NRW. Essen (lnw) - Tempestas in North Rheno-Westphalia est nebulosus et nubilus cum paucis signis laetitiae tertiae in adventu volutpat. Secundum regional,2025-12-15 03:52:26+00:00
