index,published,keyword,domain,language,valid,title,description,url,image,archive,content,quote,de,en,la,added
9b58b59e45fb6091c587083a4d7e5366,2026-05-16T17:32:07Z,'Nebel Verletzte',www.welt.de,de,0.8,"„Wahnsinn, vollkommen inakzeptabel“ – Verletzte nach Frankfurter Pyro-Aktion",Die Fans von Eintracht Frankfurt hüllen das eigene Stadion in dichten Nebel. Bei der Aktion gibt es zwei Verletzte. Auch Raketen fliegen. Ein Vorstandsmitglied verurteilt die Aktion scharf.,https://www.welt.de/sport/fussball/bundesliga/eintracht-frankfurt/article6a08a25e1bde982bd10fe157/eintracht-frankfurt-wahnsinn-vollkommen-inakzeptabel-verletzte-nach-pyro-aktion.html,https://images.welt.de/6a08a25e1bde982bd10fe157/f73b08596b2858c7355d80059a73b539-master/ci16x9-w1200/595076903-jpg,http://web.archive.org/web/20260518205114/https://www.welt.de/sport/fussball/bundesliga/eintracht-frankfurt/article6a08a25e1bde982bd10fe157/eintracht-frankfurt-wahnsinn-vollkommen-inakzeptabel-verletzte-nach-pyro-aktion.html,Die Fans von Eintracht Frankfurt hüllen das eigene Stadion in dichten Nebel. Bei der Aktion gibt es zwei Verletzte. Auch Raketen fliegen. Ein Vorstandsmitglied verurteilt die Aktion scharf.Beim Spiel… [+1775 chars],,"„Wahnsinn, vollkommen inakzeptabel“ – Verletzte nach Frankfurter Pyro-Aktion. Die Fans von Eintracht Frankfurt hüllen das eigene Stadion in dichten Nebel. Bei der Aktion gibt es zwei Verletzte. Auch Raketen fliegen. Ein Vorstandsmitglied verurteilt die Aktion scharf.","“Insanity, completely unacceptable” – Injured after Frankfurt pyrotechnic event. The fans of Eintracht Frankfurt cover their own stadium in thick fog. Two people were injured in the action. Rockets also fly. A board member strongly condemns the action.","""Insania, omnino inconveniens"" - Post pyrotechnicos Francofurtensis laesa eventus. Fans Eintracht Frankfurt densissima nebula stadium suum tegunt. Duo homines in actione laesi sunt. Rockets also fly. Socius tabulae actionem vehementer condemnat.",2026-05-18 20:50:43+00:00
da349e485a4643572319a274ec41d6f4,2026-05-18T07:05:35Z,'Nebel Wetter',www.stern.de,de,0.8,Wetter: Wochenstart in Niedersachsen und Bremen wechselhaftem Wetter,"Von Starkregen bis Sonne – der Wochenbeginn bringt alles mit. Wo Gewitter drohen, wo es besonders mild bleibt und wann dichter Nebel die Sicht einschränkt.",https://www.stern.de/gesellschaft/regional/niedersachsen-bremen/wetter--wochenstart-in-niedersachsen-und-bremen-wechselhaftem-wetter-37406028.html,https://image.stern.de/37406030/t/5U/v1/w1440/r1.7778/-/18--xhxwo2pmi7v17axs2048jpeg---7d6d901f7269e755.jpg,,"Kopiere den aktuellen Link
Zur Merkliste hinzufügen
Von Starkregen bis Sonne der Wochenbeginn bringt alles mit. Wo Gewitter drohen, wo es besonders mild bleibt und wann dichter Nebel die Sicht eins… [+948 chars]",,"Wetter: Wochenstart in Niedersachsen und Bremen wechselhaftem Wetter. Von Starkregen bis Sonne – der Wochenbeginn bringt alles mit. Wo Gewitter drohen, wo es besonders mild bleibt und wann dichter Nebel die Sicht einschränkt.","Weather: Changeable weather at the start of the week in Lower Saxony and Bremen. From heavy rain to sunshine – the beginning of the week brings it all. Where there is a risk of thunderstorms, where it remains particularly mild and when thick fog limits visibility.","Weather: mutabilis tempestas ineunte septimanae in Saxonia inferiori et Bremensi. Ab imbre ad soles – principium hebdomadis omnia fert. Ubi periculum est tonitribus, ubi maxime lenis manet, et cum densa nebula limitat visibilitatem.",2026-05-20 16:35:03+00:00
04807642d7f101b7e6310fd648e49deb,2026-05-19T07:05:06Z,'Nebel Wetter',www.stern.de,de,0.8,Wetter: Maiwetter bleibt launisch in Niedersachsen,"Regen, Sonne, Nebel: Das Maiwetter in Niedersachsen überrascht mit schnellen Wechseln. Wer in Niedersachsen draußen unterwegs ist, sollte diese Woche flexibel bleiben.",https://www.stern.de/gesellschaft/regional/niedersachsen-bremen/wetter--maiwetter-bleibt-launisch-in-niedersachsen-37410188.html,https://image.stern.de/37410190/t/v1/v1/w1440/r1.7778/-/19--vkwgcbtos6v14axs2048jpeg---9c8a3abe9c3ecd13.jpg,,"Kopiere den aktuellen Link
Zur Merkliste hinzufügen
Regen, Sonne, Nebel: Das Maiwetter in Niedersachsen überrascht mit schnellen Wechseln. Wer in Niedersachsen draußen unterwegs ist, sollte diese W… [+1094 chars]",,"Wetter: Maiwetter bleibt launisch in Niedersachsen. Regen, Sonne, Nebel: Das Maiwetter in Niedersachsen überrascht mit schnellen Wechseln. Wer in Niedersachsen draußen unterwegs ist, sollte diese Woche flexibel bleiben.","Weather: May weather remains moody in Lower Saxony. Rain, sun, fog: The May weather in Lower Saxony surprises with its rapid changes. Anyone who is out and about in Lower Saxony should remain flexible this week.","Tempestas: tempestas tristis in Saxonia inferiori manet. Pluvia, sol, nebula: Maius tempestas in inferiori Saxonia cum suis celeribus mutationibus obrepserit. Quicumque est extra et circa in Saxonia inferiori, hac hebdomade flexibilis manere debet.",2026-05-22 10:30:54+00:00
