index,published,keyword,domain,language,valid,title,description,url,image,archive,content,quote,de,en,la,added
cd45f2ba3857a24c7dcd7689186cdd07,2025-12-13T15:59:20Z,'Nebel Wetter',www.bild.de,de,0.8,Nebel und grauer Himmel - Am 3. Advent der Winter pennt,Statt klirrender Kälte gibt's mancherorts sogar zweistellige Temperaturen. Bleibt es auch am Sonntag so? BILD fragte bei drei Wetter-Experten nach.,https://www.bild.de/news/wetter/nebeldecke-ueber-deutschland-so-wird-das-wetter-in-ihrer-region-693d526df679420e000b36d4,"https://images.bild.de/693d526df679420e000b36d4/47930b2033ab66392663eb3a20761d73,4202c0ab?w=1280",,"Grauer Himmel statt Schneegestöber, Nebelschwaden statt Winterzauber der Advent zeigt sich in diesem Jahr von seiner trüben und vor allem milden Seite. Auch an diesem Sonntag? BILD fragte bei drei We… [+3294 chars]",,Nebel und grauer Himmel - Am 3. Advent der Winter pennt. Statt klirrender Kälte gibt's mancherorts sogar zweistellige Temperaturen. Bleibt es auch am Sonntag so? BILD fragte bei drei Wetter-Experten nach.,"Fog and gray sky - Winter falls asleep on the 3rd Advent. Instead of bitter cold, in some places there are even double-digit temperatures. Will it stay that way on Sunday too? BILD asked three weather experts.","Caligo et caelum glaucum - Hiems obdormivit in III adventu. Loco frigoris amarae, in quibusdam locis etiam sunt temperaturae duplices digiti. Etiamne die dominico sic manebit? AVAX tres tempestatum peritos quaesivit.",2025-12-15 03:52:26+00:00
c13fb800c3b447ff1f1f345b693954f2,2025-12-11T05:49:57Z,'Nebel Wetter',www.stern.de,de,0.8,"Wetterbericht: Nebelscheinwerfer an: Wo es trüb bleibt, wo es sonnig wird","Stuttgart (lsw) - Das Wetter ist aktuell eher ein Fall für Schal und Nebelscheinwerfer - wer im Südwesten unterwegs ist, sollte sich auf trübe Aussichten",https://www.stern.de/gesellschaft/regional/baden-wuerttemberg/wetterbericht--nebelscheinwerfer-an--wo-es-trueb-bleibt--wo-es-sonnig-wird-36950216.html,https://image.stern.de/36950218/t/67/v1/w1440/r1.7778/-/11--ei3dmbgyn2v3axs2048jpeg---5c4ae8b83410681a.jpg,,"Kopiere den aktuellen Link
Zur Merkliste hinzufügen
Im Allgäu wird's nachts glatt, an der Donau bleibt der Nebel hartnäckig. Wo die Sonne trotzdem Chancen hat und welche Regionen im Dauergrau versi… [+2218 chars]",,"Wetterbericht: Nebelscheinwerfer an: Wo es trüb bleibt, wo es sonnig wird. Stuttgart (lsw) - Das Wetter ist aktuell eher ein Fall für Schal und Nebelscheinwerfer - wer im Südwesten unterwegs ist, sollte sich auf trübe Aussichten","Weather report: Fog lights on: Where it stays cloudy, where it gets sunny. Stuttgart (lsw) - The weather is currently more of a case for scarves and fog lights - anyone traveling in the southwest should be prepared for cloudy prospects","Tempestas fama: Nebula lumina in: Ubi nubilum manet, ubi serenum est. Stuttgart (lsw) - Tempestas in praesenti plus casus in fascias et nebulas luminum est - quis in meridiem iter ad spem nubilum praeparari debet",2025-12-16 03:44:36+00:00
78c3de9536d512bfa735118d61ff1055,2025-12-11T11:52:16Z,'Nebel Wetter',www.diepresse.com,de,0.8,Wetter: Am Wochenende bleibt es mild,Hochdruckeinfluss bringt Nebel in den Niederungen und Sonne im Gebirge.,https://www.diepresse.com/20396545/wetter-am-wochenende-bleibt-es-mild,https://img.diepresse.com/public/incoming/ax1k6q-kein-Titel/alternates/DPR_SOCIAL_NACHRICHTEN/kein%20Titel,,"Hochdruckeinfluss bringt Nebel in den Niederungen und Sonne im Gebirge. 
Relativ unverändert mild präsentiert sich das Wetter laut Geosphere-Prognose in den kommenden Tagen. Es herrscht weiterhin ge… [+2611 chars]",,Wetter: Am Wochenende bleibt es mild. Hochdruckeinfluss bringt Nebel in den Niederungen und Sonne im Gebirge.,Weather: It will remain mild at the weekend. The influence of high pressure brings fog in the lowlands and sunshine in the mountains.,Weather: Sed mollis in volutpat vestibulum. Influentia pressurae altae nebulam in campestribus et iubar in montibus affert.,2025-12-16 03:44:36+00:00
774182e29d4584fee8faf594fdce403d,2025-12-12T04:50:46Z,'Nebel Wetter',www.zeit.de,de,0.8,Wetter in Bayern: Kalte Nebelsuppe im Tal und Sonne in den Bergen,Hier finden Sie Informationen zu dem Thema „Wetter in Bayern“. Lesen Sie jetzt „Kalte Nebelsuppe im Tal und Sonne in den Bergen“.,https://www.zeit.de/news/2025-12/12/kalte-nebelsuppe-im-tal-und-sonne-in-den-bergen,https://img.zeit.de/news/2025-12/12/kalte-nebelsuppe-im-tal-und-sonne-in-den-bergen-image-group/wide__1300x731,,"Wer am Wochenende Sonne tanken will, muss in die Berge - oder zumindest in die Nähe. Eine trübe Suppe aus Hochnebel, Nebel und Sprühregen sagt der Deutsche Wetterdienst (DWD) bis Sonntag für weite Te… [+623 chars]",,Wetter in Bayern: Kalte Nebelsuppe im Tal und Sonne in den Bergen. Hier finden Sie Informationen zu dem Thema „Wetter in Bayern“. Lesen Sie jetzt „Kalte Nebelsuppe im Tal und Sonne in den Bergen“.,Weather in Bavaria: Cold fog in the valley and sun in the mountains. Here you will find information on the topic of “Weather in Bavaria”. Now read “Cold mist soup in the valley and sun in the mountains”.,"Tempestas in Bavaria: frigus est in valle et sol in montibus. Hic informationes invenies de argumento ""Tempestatis in Bavaria"". Nunc legitur ""Frigidi caligo elit in valle et sol in montibus"".",2025-12-16 03:44:36+00:00
4265664ef55bbe88005ce5625294d784,2025-12-12T04:50:46Z,'Nebel Wetter',www.stern.de,de,0.8,Wetter in Bayern: Kalte Nebelsuppe im Tal und Sonne in den Bergen,"München (lby) - Wer am Wochenende Sonne tanken will, muss in die Berge - oder zumindest in die Nähe. Eine trübe Suppe aus Hochnebel, Nebel und Sprühregen",https://www.stern.de/gesellschaft/regional/bayern/wetter-in-bayern--kalte-nebelsuppe-im-tal-und-sonne-in-den-bergen-36954442.html,https://image.stern.de/36954444/t/jD/v1/w1440/r1.7778/-/12--kvyjbjp5xev8axs2048jpeg---889d07cd7813e41e.jpg,,"Kopiere den aktuellen Link
Zur Merkliste hinzufügen
Schönes Winterwetter? Das sieht anders aus. Doch es gibt eine Region in Bayern, die auf Sonne hoffen kann.
Wer am Wochenende Sonne tanken will, … [+745 chars]",,"Wetter in Bayern: Kalte Nebelsuppe im Tal und Sonne in den Bergen. München (lby) - Wer am Wochenende Sonne tanken will, muss in die Berge - oder zumindest in die Nähe. Eine trübe Suppe aus Hochnebel, Nebel und Sprühregen","Weather in Bavaria: Cold fog in the valley and sun in the mountains. Munich (lby) - If you want to soak up the sun at the weekend, you have to go to the mountains - or at least close by. A cloudy soup of high fog, mist and drizzle","Tempestas in Bavaria: frigus est in valle et sol in montibus. Munich (lby) - Si vis exsugere solem in volutpat, ad montes ire debes - vel saltem prope. Pulmentum nubilum altae nebulae, nebulae et levis",2025-12-16 03:44:36+00:00
6b0eb0e8f3e2b2b7be34e0655a399c1c,2025-12-12T05:10:53Z,'Nebel Wetter',www.tagesspiegel.de,de,0.8,Wettervorhersage: Grauer Start und sonniger Abschluss,"Sonne, Wolken und Nebel sind in den nächsten Tagen im ständigen Wechselspiel. Der Sonntag wartet mit besonders viel Sonnenschein auf.",https://www.tagesspiegel.de/berlin/wettervorhersage-grauer-start-und-sonniger-abschluss-15044722.html,https://www.tagesspiegel.de/images/15044721/alternates/BASE_16_9_W1400/1765516253000/morgenstimmung-in-brandenburg.jpeg,,Das dritte Adventswochenende bringt wechselhaftes und mildes Wetter nach Berlin und Brandenburg. Frost und Nebel mischen sich laut Deutschem Wetterdienst (DWD) in die Aussichten. Der Sonntag hingegen… [+920 chars],,"Wettervorhersage: Grauer Start und sonniger Abschluss. Sonne, Wolken und Nebel sind in den nächsten Tagen im ständigen Wechselspiel. Der Sonntag wartet mit besonders viel Sonnenschein auf.","Weather forecast: Gray start and sunny finish. Sun, clouds and fog will be in constant interplay over the next few days. Sunday offers particularly lots of sunshine.","Tempestas praenuntiet: Gray initium et finem apricum. Sol, nubes, nebula in paucis diebus assidue erunt. Solis sortes apprime offert Solis.",2025-12-16 03:44:36+00:00
1f1e7b6c3bf53523a986b52cfbcd651a,2025-12-12T05:55:55Z,'Nebel Wetter',www.zeit.de,de,0.8,Deutscher Wetterdienst: Sonne und Nebel – Wetter bleibt meist trocken,Hier finden Sie Informationen zu dem Thema „Deutscher Wetterdienst“. Lesen Sie jetzt „Sonne und Nebel – Wetter bleibt meist trocken“.,https://www.zeit.de/news/2025-12/12/sonne-und-nebel-wetter-bleibt-meist-trocken,https://img.zeit.de/news/2025-12/12/sonne-und-nebel-wetter-bleibt-meist-trocken-image-group/wide__1300x731,,Auf eher milde Temperaturen und teils sogar sonniges Wetter können sich die Menschen in Mitteldeutschland einstellen. Nach einem leicht nebligen und frostigen Start in den Tag ist in Sachsen und in S… [+726 chars],,Deutscher Wetterdienst: Sonne und Nebel – Wetter bleibt meist trocken. Hier finden Sie Informationen zu dem Thema „Deutscher Wetterdienst“. Lesen Sie jetzt „Sonne und Nebel – Wetter bleibt meist trocken“.,German Weather Service: Sun and fog – the weather mostly stays dry. Here you will find information on the topic of “German Weather Service”. Now read “Sun and fog – the weather mostly stays dry”.,"German Weather Service: Sol et nebula - tempestas plerumque siccescit. Hic informationes invenies in argumento ""Tempestatis Germanicae Service"". Nunc legitur ""sol et nebula - tempestas plerumque siccescit"".",2025-12-16 03:44:36+00:00
643b305444758382cf53587e366e06a5,2025-12-13T06:25:52Z,'Nebel Wetter',www.zeit.de,de,0.8,Wetter im Freistaat: Viel Nebel in Bayern erwartet - mit einer Ausnahme,Hier finden Sie Informationen zu dem Thema „Wetter im Freistaat“. Lesen Sie jetzt „Viel Nebel in Bayern erwartet - mit einer Ausnahme“.,https://www.zeit.de/news/2025-12/13/viel-nebel-in-bayern-erwartet-mit-einer-ausnahme,https://img.zeit.de/news/2025-12/13/viel-nebel-in-bayern-erwartet-mit-einer-ausnahme-image-group/wide__1300x731,,Das dritte Adventswochenende in Bayern startet mit dichtem Nebel und Nieselregen. Doch nicht überall im Freistaat wird es trüb: In den Alpentälern herrsche «völlig anderes Wetter» mit viel Sonnensche… [+394 chars],,Wetter im Freistaat: Viel Nebel in Bayern erwartet - mit einer Ausnahme. Hier finden Sie Informationen zu dem Thema „Wetter im Freistaat“. Lesen Sie jetzt „Viel Nebel in Bayern erwartet - mit einer Ausnahme“.,Weather in the Free State: A lot of fog expected in Bavaria - with one exception. Here you will find information on the topic of “Weather in the Free State”. Now read “A lot of fog expected in Bavaria - with one exception”.,"Tempestas in civitate libera: Multum nebula expectatur in Bavaria - uno excepto. Hic informationes invenies in argumento ""Tempestatis in libera republica"". Nunc legitur ""Multum nebula expectata in Bavaria - uno excepto"".",2025-12-17 03:40:26+00:00
8a8be7e0c2b135d580e30edaaa34f192,2025-12-13T06:25:52Z,'Nebel Wetter',www.stern.de,de,0.8,Wetter im Freistaat: Viel Nebel in Bayern erwartet - mit einer Ausnahme,München (lby) - Das dritte Adventswochenende in Bayern startet mit dichtem Nebel und Nieselregen. Doch nicht überall im Freistaat wird es trüb: In den,https://www.stern.de/gesellschaft/regional/bayern/wetter-im-freistaat--viel-nebel-in-bayern-erwartet---mit-einer-ausnahme-36958180.html,https://image.stern.de/36958182/t/85/v1/w1440/r1.7778/-/13--o65rmntojfv4axs2048jpeg---67cb89d5a7c18fb2.jpg,,"Kopiere den aktuellen Link
Zur Merkliste hinzufügen
Vor allem zum Start ins dritte Adventswochenende bleibt es in Bayern überwiegend neblig - außer in den Alpen.
Das dritte Adventswochenende in Ba… [+519 chars]",,Wetter im Freistaat: Viel Nebel in Bayern erwartet - mit einer Ausnahme. München (lby) - Das dritte Adventswochenende in Bayern startet mit dichtem Nebel und Nieselregen. Doch nicht überall im Freistaat wird es trüb: In den,Weather in the Free State: A lot of fog expected in Bavaria - with one exception. Munich (lby) - The third Advent weekend in Bavaria starts with thick fog and drizzle. But things don't get gloomy everywhere in the Free State: in the,Tempestas in civitate libera: Multum nebula expectatur in Bavaria - uno excepto. Munich (lby) - Tertia volutpat Adventus in Bavaria incipit nebula densa et levis. Sed res non ubique tristis in re publica libera: in,2025-12-17 03:40:26+00:00
5f03f12c000bfeccec2c3f203fdf093d,2025-12-13T06:40:51Z,'Nebel Wetter',www.zeit.de,de,0.8,Wetter: Nebeliger Start ins Wochenende,Hier finden Sie Informationen zu dem Thema „Wetter“. Lesen Sie jetzt „Nebeliger Start ins Wochenende“.,https://www.zeit.de/news/2025-12/13/nebeliger-start-ins-wochenende,https://img.zeit.de/news/2025-12/13/nebeliger-start-ins-wochenende-image-group/wide__1300x731,,"In Berlin und Brandenburg macht sich die Sonne heute rar. Laut Deutschem Wetterdienst (DWD) ist es am Morgen vielerorts dunstig oder neblig, zum Teil mit Sichtweiten unter 150 Metern. Tagsüber bleibt… [+681 chars]",,Wetter: Nebeliger Start ins Wochenende. Hier finden Sie Informationen zu dem Thema „Wetter“. Lesen Sie jetzt „Nebeliger Start ins Wochenende“.,Weather: Foggy start to the weekend. Here you will find information on the topic of “weather”. Read “Foggy start to the weekend” now.,"Weather: Foggy eu tincidunt volutpat vestibulum. Hic informationes invenies in argumento ""tempestatis"". Legere ""Foggy incipit volutpat"" nunc.",2025-12-17 03:40:26+00:00
a46157e36c0f4270da0362ae5486ffff,2025-12-13T06:40:51Z,'Nebel Wetter',www.stern.de,de,0.8,Wetter: Nebeliger Start ins Wochenende,"Wer in Berlin und Brandenburg auf Sonne hofft, braucht Geduld: Erst sind Nebel und Wolken angesagt, dann lockert es auf. Wann sich das Wetter wirklich dreht, verrät der Ausblick für nächste Woche.",https://www.stern.de/gesellschaft/regional/berlin-brandenburg/wetter--nebeliger-start-ins-wochenende-36958190.html,https://image.stern.de/36958192/t/Ez/v1/w1440/r1.7778/-/13--ehexa4d2rqv4axs2048jpeg---6e7b4a613c76b36b.jpg,,"Kopiere den aktuellen Link
Zur Merkliste hinzufügen
Wer in Berlin und Brandenburg auf Sonne hofft, braucht Geduld: Erst sind Nebel und Wolken angesagt, dann lockert es auf. Wann sich das Wetter wir… [+893 chars]",,"Wetter: Nebeliger Start ins Wochenende. Wer in Berlin und Brandenburg auf Sonne hofft, braucht Geduld: Erst sind Nebel und Wolken angesagt, dann lockert es auf. Wann sich das Wetter wirklich dreht, verrät der Ausblick für nächste Woche.","Weather: Foggy start to the weekend. Anyone hoping for sun in Berlin and Brandenburg needs patience: first there will be fog and clouds, then it clears up. The outlook for next week reveals when the weather will actually change.","Weather: Foggy eu tincidunt volutpat vestibulum. Quisquis solem in Berlin et Brandenburg sperat patientia eget: primum nebula et nubes erunt, deinde serenat. Exspectatio septimanae proximae ostendit quando tempestas actu mutatur.",2025-12-17 03:40:26+00:00
06bb4bb3388b3c5c038d960ed3c1d914,2025-12-13T06:42:40Z,'Nebel Wetter',www.tagesspiegel.de,de,0.8,Wetter: Nebeliger Start ins Wochenende,"Wer in Berlin und Brandenburg auf Sonne hofft, braucht Geduld: Erst sind Nebel und Wolken angesagt, dann lockert es auf. Wann sich das Wetter wirklich dreht, verrät der Ausblick für nächste Woche.",https://www.tagesspiegel.de/berlin/wetter-nebeliger-start-ins-wochenende-15047807.html,https://www.tagesspiegel.de/images/15047806/alternates/BASE_16_9_W1400/1765608159000/trubes-winterwetter-am-scharmutzelsee.jpeg,,"In Berlin und Brandenburg macht sich die Sonne heute rar. Laut Deutschem Wetterdienst (DWD) ist es am Morgen vielerorts dunstig oder neblig, zum Teil mit Sichtweiten unter 150 Metern. Tagsüber bleibt… [+735 chars]",,"Wetter: Nebeliger Start ins Wochenende. Wer in Berlin und Brandenburg auf Sonne hofft, braucht Geduld: Erst sind Nebel und Wolken angesagt, dann lockert es auf. Wann sich das Wetter wirklich dreht, verrät der Ausblick für nächste Woche.","Weather: Foggy start to the weekend. Anyone hoping for sun in Berlin and Brandenburg needs patience: first there will be fog and clouds, then it clears up. The outlook for next week reveals when the weather will actually change.","Weather: Foggy eu tincidunt volutpat vestibulum. Quisquis solem in Berlin et Brandenburg sperat patientia eget: primum nebula et nubes erunt, deinde serenat. Exspectatio septimanae proximae ostendit quando tempestas actu mutatur.",2025-12-17 03:40:26+00:00
f9abbe383d48f57374f271b09fc84a4b,2025-12-13T06:42:40Z,'Nebel Wetter',www.tagesspiegel.de,de,0.8,Lichtblick am Sonntag: Nebeliger Start ins Wochenende in Berlin und Brandenburg,"Wer in Berlin und Brandenburg auf Sonne hofft, braucht Geduld: Erst sind Nebel und Wolken angesagt, dann lockert es auf. Zum Start der neuen Woche soll sich das Wetter stärker drehen.",https://www.tagesspiegel.de/berlin/lichtblick-am-sonntag-nebeliger-start-ins-wochenende-in-berlin-und-brandenburg-15047807.html,https://www.tagesspiegel.de/images/15047806/alternates/BASE_16_9_W1400/1765608159000/trubes-winterwetter-am-scharmutzelsee.jpeg,,"In Berlin und Brandenburg macht sich die Sonne heute rar. Laut Deutschem Wetterdienst (DWD) ist es am Morgen vielerorts dunstig oder neblig, zum Teil mit Sichtweiten unter 150 Metern. Tagsüber bleibt… [+1073 chars]",,"Lichtblick am Sonntag: Nebeliger Start ins Wochenende in Berlin und Brandenburg. Wer in Berlin und Brandenburg auf Sonne hofft, braucht Geduld: Erst sind Nebel und Wolken angesagt, dann lockert es auf. Zum Start der neuen Woche soll sich das Wetter stärker drehen.","Bright spot on Sunday: Foggy start to the weekend in Berlin and Brandenburg. Anyone hoping for sun in Berlin and Brandenburg needs patience: first there will be fog and clouds, then it clears up. At the start of the new week the weather is expected to change more.","Lucens macula die Dominico: Foggy incipiet volutpat vestibulum Berolini et Brandenburgici. Quisquis solem in Berlin et Brandenburg sperat patientia eget: primum nebula et nubes erunt, deinde serenat. Ineunte septimanae novae tempestas magis mutanda expectatur.",2025-12-17 03:40:26+00:00
c3053b6b1dcfdaaec183e1dea258b58d,2025-12-14T06:45:45Z,'Nebel Wetter',www.stern.de,de,0.8,Wetter: Wochenstart verspricht Pause vom Dauergrau,Stuttgart (lsw) - Das teils hartnäckige Dauergrau soll zum Wochenstart eine Pause einlegen. Während am Sonntag noch viele Wolken und Nebel über dem,https://www.stern.de/gesellschaft/regional/baden-wuerttemberg/wetter--wochenstart-verspricht-pause-vom-dauergrau-36959870.html,https://image.stern.de/36959872/t/MH/v1/w1440/r1.7778/-/14--oknchw2p5zv15axs2048jpeg---c6566bbd45ce7b35.jpg,,"Kopiere den aktuellen Link
Zur Merkliste hinzufügen
Lichtblick in der Nebelsuppe: Nach oftmals grauen Tagen ist laut DWD am Montag endlich Sonne in Sicht - doch nicht überall.
Das teils hartnäckig… [+1297 chars]",,Wetter: Wochenstart verspricht Pause vom Dauergrau. Stuttgart (lsw) - Das teils hartnäckige Dauergrau soll zum Wochenstart eine Pause einlegen. Während am Sonntag noch viele Wolken und Nebel über dem,Weather: The start of the week promises a break from the constant gray. Stuttgart (lsw) - The sometimes persistent gray should take a break at the start of the week. While on Sunday there were still a lot of clouds and fog above,Tempestas: Initium hebdomadis promittit continuas continuas griseas. Stuttgart (lsw) - Interdum griseus constans in initio hebdomadis intermissum debet accipere. Dum die dominico adhuc multae nubes et nebula supra erant,2025-12-17 03:40:26+00:00
239b1097cf7c2700fc0bedfe4116473b,2025-12-14T09:18:42Z,'Nebel Wetter',www.bild.de,de,0.8,Wetter am Sonntag - Nebeldecke über Deutschland – mit Chancen auf Sonne,Wettervorhersage für den 3. Advent: Wo sich die Sonne heute zeigen könnte.,https://www.bild.de/news/wetter/wetter-am-sonntag-nebeldecke-ueber-deutschland-mit-chancen-auf-sonne-693d526df679420e000b36d4,"https://images.bild.de/693d526df679420e000b36d4/47930b2033ab66392663eb3a20761d73,d19367f9?w=1280",,"Grauer Himmel statt Schneegestöber, Nebelschwaden statt Winterzauber der Advent zeigt sich in diesem Jahr von seiner trüben und vor allem milden Seite. Auch an diesem Sonntag? BILD fragte bei drei We… [+3294 chars]",,Wetter am Sonntag - Nebeldecke über Deutschland – mit Chancen auf Sonne. Wettervorhersage für den 3. Advent: Wo sich die Sonne heute zeigen könnte.,Weather on Sunday - blanket of fog over Germany - with chances of sunshine. Weather forecast for the 3rd Advent: Where the sun could appear today.,Tempestas die Dominico - stragulum nebulae in Germania - cum solis casibus. Tempestas praenuntietur pro III Adventu: Ubi sol hodie apparere potuit.,2025-12-17 03:40:26+00:00
f4e8bbc2dc7cd1e573e6939b22f64e6e,2025-12-14T09:28:48Z,'Nebel Wetter',www.stern.de,de,0.8,Wetter: Heiteres Wetter zum Wochenstart in Rheinland-Pfalz,"Mainz (lrs) - Zunächst noch viele Wolken und Nebel am Wochenende, dann endlich wieder mehr Sonne. Nach neblig-trübem Winterwetter können sich die Menschen",https://www.stern.de/gesellschaft/regional/rheinland-pfalz-saarland/wetter--heiteres-wetter-zum-wochenstart-in-rheinland-pfalz-36960142.html,https://image.stern.de/36960144/t/Cb/v1/w1440/r1.7778/-/14--2y6alvm6nsv16axs2048jpeg---78e2f0cda4a7e176.jpg,,"Kopiere den aktuellen Link
Zur Merkliste hinzufügen
Nach trüben Wintertagen lockert das Wetter in Rheinland-Pfalz und Saarland ab Montag auf - und es wird sonnig.
Zunächst noch viele Wolken und Ne… [+812 chars]",,"Wetter: Heiteres Wetter zum Wochenstart in Rheinland-Pfalz. Mainz (lrs) - Zunächst noch viele Wolken und Nebel am Wochenende, dann endlich wieder mehr Sonne. Nach neblig-trübem Winterwetter können sich die Menschen","Weather: Bright weather at the start of the week in Rhineland-Palatinate. Mainz (lrs) - Initially a lot of clouds and fog at the weekend, then finally more sun again. After foggy, cloudy winter weather, people can relax","Tempestas: Serena tempestas ineunte septimanae in Rheno-Palatinato. Mogontiacum (lrs) - Initio multum nebulae et nebulae in volutpat vestibulum, tunc demum magis sol iterum. Post nebulosus, nubila tempestas hiemis, homines relaxare possunt",2025-12-17 03:40:26+00:00
21b698eb72d695b834648dafc5a44be6,2025-12-14T13:38:28Z,'Nebel Wetter',www.n-tv.de,de,0.8,Wetterwoche im Schnellcheck: Die Vorweihnachtszeit bleibt mild - und schneelos,"Weihnachten rückt näher - doch ob es weiße Feiertage gibt, ist bisher unklar. In der neuen Woche fällt jedenfalls kein Schnee, vereinzelt gibt es jedoch Regen und Nebel. Ab Montag steigen die Temperaturen vielerorts sogar auf über zehn Grad, begleitet von vie…",https://www.n-tv.de/panorama/Die-Vorweihnachtszeit-bleibt-mild-und-schneelos-id30141179.html,https://www.n-tv.de/img/30141254/1765712127/Img_16_9/1200/12-12-2025-Wuppertal-Weihnachtsmarkt-Haus-Schloss-Luentenbeck.jpg,,"Erst zum 4. Adventswochenende wird es etwas kühler. (Foto: picture alliance / Maximilian Koch)
Weihnachten rückt näher - doch ob es weiße Feiertage gibt, ist bisher unklar. In der neuen Woche fällt … [+3179 chars]",,"Wetterwoche im Schnellcheck: Die Vorweihnachtszeit bleibt mild - und schneelos. Weihnachten rückt näher - doch ob es weiße Feiertage gibt, ist bisher unklar. In der neuen Woche fällt jedenfalls kein Schnee, vereinzelt gibt es jedoch Regen und Nebel. Ab Montag steigen die Temperaturen vielerorts sogar auf über zehn Grad, begleitet von vie…","Weather week in quick check: The run-up to Christmas remains mild - and snowless. Christmas is approaching - but it is still unclear whether there will be white holidays. In any case, no snow will fall in the new week, but there will be occasional rain and fog. From Monday, temperatures will even rise to over ten degrees in many places, accompanied by many…","Tempestas hebdomadis in reprehendo velox: Currens usque ad Nativitatem Domini mitis manet - et nives. Nativitas Domini appropinquat - sed adhuc incertum est an feriae albae erunt. Certe nulla nix in nova septimana cadet, sed pluvia et nebula occasionales erunt. A Lunae, temperaturas usque ad decem gradus in multis locis ascendent, cum multis…",2025-12-17 03:40:26+00:00
f72dd90d0b1bb72748573311b4123937,2025-12-15T06:29:56Z,'Nebel Wetter',www.stern.de,de,0.8,"Wetter: Sonne in den Bergen, Nebel in vielen Teilen Bayerns",München (lby) - Die neue Woche bringt in Bayern Nebel und Sonne in den Bergen. Am Dienstag rechnet der Deutsche Wetterdienst (DWD) in den meisten Regionen,https://www.stern.de/gesellschaft/regional/bayern/wetter--sonne-in-den-bergen--nebel-in-vielen-teilen-bayerns-36961856.html,https://image.stern.de/36961858/t/YC/v1/w1440/r1.7778/-/15--rezci3utxwv6axs2048jpeg---31f423f4cb77441e.jpg,,"Kopiere den aktuellen Link
Zur Merkliste hinzufügen
Die neue Woche beginnt mit Nebel - doch in vielen Regionen zeigt sich diese Woche auch die Sonne.
Die neue Woche bringt in Bayern Nebel und Sonn… [+1602 chars]",,"Wetter: Sonne in den Bergen, Nebel in vielen Teilen Bayerns. München (lby) - Die neue Woche bringt in Bayern Nebel und Sonne in den Bergen. Am Dienstag rechnet der Deutsche Wetterdienst (DWD) in den meisten Regionen","Weather: Sun in the mountains, fog in many parts of Bavaria. Munich (lby) - The new week brings fog and sun in the mountains in Bavaria. The German Weather Service (DWD) expects this to happen in most regions on Tuesday","Tempestas: Sol in montibus, nebula in multis Bavariae partibus. Munich (lby) - Novus hebdomade nebulam et solem in montibus Bavariae affert. The German Weather Service (DWD) Expectat hoc fieri in plerisque regionibus die Martis",2025-12-17 03:40:26+00:00
