index,published,keyword,domain,language,valid,title,description,url,image,archive,content,quote,de,en,la,added
c262dc459b633b6bb0efd9a70f2f6fe1,2026-03-01T11:38:32Z,'Nebel schlechte Sicht',www.stern.de,de,0.8,Ski alpin: Schlechte Sicht: Super-G in Garmisch abgesagt,Garmisch-Partenkirchen - Der Weltcup-Super-G der Männer in Garmisch-Partenkirchen ist wegen schlechter Sicht abgesagt worden. Nebel und Regen,https://www.stern.de/gesellschaft/regional/bayern/ski-alpin--schlechte-sicht--super-g-in-garmisch-abgesagt-37181032.html,https://image.stern.de/37181034/t/wZ/v1/w1440/r1.7778/-/01--vh6klo37a3v4axs2048jpeg---fd140bc6f140fa72.jpg,,"Kopiere den aktuellen Link
Zur Merkliste hinzufügen
Nebel und Regen in den bayerischen Alpen: Ein Weltcup-Rennen wird nicht ausgetragen.
Der Weltcup-Super-G der Männer in Garmisch-Partenkirchen is… [+682 chars]",,Ski alpin: Schlechte Sicht: Super-G in Garmisch abgesagt. Garmisch-Partenkirchen - Der Weltcup-Super-G der Männer in Garmisch-Partenkirchen ist wegen schlechter Sicht abgesagt worden. Nebel und Regen,Alpine skiing: Poor visibility: Super-G in Garmisch canceled. Garmisch-Partenkirchen - The men's World Cup Super-G in Garmisch-Partenkirchen has been canceled due to poor visibility. Fog and rain,Alpina skiing: Pauper visibilitas: Super-G in Garmisch cassatur. Garmisch-Partenkirchen - Hominum Trophaeum Super-G in Garmisch-Partenkirchen ob visibilitatem pauperum remissum est. Nebula et pluvia,2026-03-02 14:11:16+00:00
22822a33d72a7251f9cd6637a3c191ab,2026-03-01T11:50:21Z,'Nebel schlechte Sicht',sport.orf.at,de,0.8,Herren-Super-G in Garmisch abgesagt,Der für Sonntag geplante Herren-Super-G in Garmisch-Partenkirchen ist nach mehrfacher Verschiebung abgesagt worden. Nebel und demnach zu schlechte Sicht auf der Kandahar-Strecke zwangen die Rennleitung nach Zuwarten um 12.15 Uhr aus Sicherheitsgründen zu dies…,https://sport.orf.at/stories/3153069/,https://ibs.orf.at/sport?image=https%3A%2F%2Fassets.orf.at%2Fmims%2F2026%2F10%2F65%2Fcrops%2Fw%3D1200%2Ch%3D630%2Cq%3D75%2F2953232_master_1141765_ski_alpin_herren_garmisch_super_g_absage_g.jpg%3Fs%3Df5623d4be532397d8c9f3b43afb7f00ead1b77c3,,Der Garmisch-Super-G soll in knapp zwei Wochen in Courchevel nachgeholt werden. Die Abfahrt am Samstag hatte der Schweizer Marco Odermatt vor seinen Landsleuten Alexis Monney und Stefan Rogentin sowi… [+812 chars],,Herren-Super-G in Garmisch abgesagt. Der für Sonntag geplante Herren-Super-G in Garmisch-Partenkirchen ist nach mehrfacher Verschiebung abgesagt worden. Nebel und demnach zu schlechte Sicht auf der Kandahar-Strecke zwangen die Rennleitung nach Zuwarten um 12.15 Uhr aus Sicherheitsgründen zu dies…,Men's Super-G in Garmisch canceled. The men's Super-G in Garmisch-Partenkirchen planned for Sunday has been canceled after being postponed several times. Fog and therefore poor visibility on the Kandahar route forced the race management to do this after waiting at 12.15 p.m. for safety reasons...,"Hominum Super-G in Garmisch instat. Super-G hominum in Garmisch-Partenkirchen pro die dominico cogitavit postquam pluries differtur. Nebula et ideo pauper visibilitas in itinere Kandahar compulit administrationem stadii hoc facere, expectato tempore 12.15 a.m. causa salutis ...",2026-03-02 14:11:16+00:00
29f10619e23d92468a8fa1394e2a776c,2026-03-04T04:47:24Z,'Nebel Wetter',www.stern.de,de,0.8,Wetter: Sonne verwöhnt den Freistaat – örtlich Nebel,"Morgens Nebel, mittags Sonne: In Bayern wechseln sich Frühlingsgefühle und frostige Nächte ab. Was der Deutsche Wetterdienst zum Wetter bis zum Wochenende sagt.",https://www.stern.de/gesellschaft/regional/bayern/wetter--sonne-verwoehnt-den-freistaat---oertlich-nebel-37189022.html,https://image.stern.de/37189024/t/Fa/v1/w1440/r1.7778/-/04--2inqrjp5kov5axs2048jpeg---9727970bced85756.jpg,,"Kopiere den aktuellen Link
Zur Merkliste hinzufügen
Morgens Nebel, mittags Sonne: In Bayern wechseln sich Frühlingsgefühle und frostige Nächte ab. Was der Deutsche Wetterdienst zum Wetter bis zum W… [+1065 chars]",,"Wetter: Sonne verwöhnt den Freistaat – örtlich Nebel. Morgens Nebel, mittags Sonne: In Bayern wechseln sich Frühlingsgefühle und frostige Nächte ab. Was der Deutsche Wetterdienst zum Wetter bis zum Wochenende sagt.","Weather: Sun spoils the Free State - locally fog. Fog in the morning, sun at midday: Spring fever alternates with frosty nights in Bavaria. What the German Weather Service says about the weather until the weekend.","Tempestas: sol liberae rei publicae corrumpit - localiter nebula. Caligo mane, sol meridies: ver febris in Bavaria noctes pruinosas alternat. Quid Tempestas Germanica dicit de tempestate usque ad volutpat vestibulum.",2026-03-05 14:10:20+00:00
f1cf70c7602d740c4808da6f49d3722a,2026-03-02T04:43:39Z,'Nebel Wetter',www.stern.de,de,0.8,Wetter: Viel Sonne zum Wochenstart - bleibt das Wetter so?,München (lby) - Zum Beginn der Woche startet der Frühling in Bayern weiter durch. Nach sich zum Teil zögerlich auflösendem Nebel bringt der Montag laut,https://www.stern.de/gesellschaft/regional/bayern/wetter--viel-sonne-zum-wochenstart---bleibt-das-wetter-so--37182130.html,https://image.stern.de/37182132/t/_h/v1/w1440/r1.7778/-/02--pavfnzifygv3axs2048jpeg---2f6b877a1022b480.jpg,,"Kopiere den aktuellen Link
Zur Merkliste hinzufügen
Der Frühling legt richtig los: Sonne satt in Bayern und milde Temperaturen. Ein Ausblick auf die nächsten Tage.
Zum Beginn der Woche startet der… [+1000 chars]",,Wetter: Viel Sonne zum Wochenstart - bleibt das Wetter so?. München (lby) - Zum Beginn der Woche startet der Frühling in Bayern weiter durch. Nach sich zum Teil zögerlich auflösendem Nebel bringt der Montag laut,"Weather: Lots of sun at the start of the week - will the weather stay like this? Munich (lby) - At the beginning of the week, spring continues to take off in Bavaria. After the fog slowly dissipates, Monday brings loud noises","Tempestas: Sortes solis ineunte hebdomade - tempestas sic erit? Munich (lby) - Initio hebdomadis fons in Bavaria pergit auferre. Post nebula lente dissipat, Lunae sonos adfert",2026-03-06 14:04:46+00:00
ac16a5a21137d36400f949b9a36cc5db,2026-03-02T08:10:08Z,'Nebel Wetter',www.stern.de,de,0.8,Wetter: Frühlingshafte Tage in Hamburg und Schleswig-Holstein,Warme Luft aus Südwesten sorgt für Sonnenmomente und bis zu 14 Grad – doch ein Tag bringt überraschend kühle Luft und Nebel. Was der Wetterdienst für Hamburg und Schleswig-Holstein prognostiziert.,https://www.stern.de/gesellschaft/regional/hamburg-schleswig-holstein/wetter--fruehlingshafte-tage-in-hamburg-und-schleswig-holstein-37182512.html,https://image.stern.de/37182514/t/AM/v1/w1440/r1.7778/-/02--bhes3o5lmyv11axs2048jpeg---8f4418412ac21fc4.jpg,http://web.archive.org/web/20260302082118/https://www.stern.de/gesellschaft/regional/hamburg-schleswig-holstein/wetter--fruehlingshafte-tage-in-hamburg-und-schleswig-holstein-37182512.html,"Kopiere den aktuellen Link
Zur Merkliste hinzufügen
Warme Luft aus Südwesten sorgt für Sonnenmomente und bis zu 14 Grad doch ein Tag bringt überraschend kühle Luft und Nebel. Was der Wetterdienst f… [+1137 chars]",,Wetter: Frühlingshafte Tage in Hamburg und Schleswig-Holstein. Warme Luft aus Südwesten sorgt für Sonnenmomente und bis zu 14 Grad – doch ein Tag bringt überraschend kühle Luft und Nebel. Was der Wetterdienst für Hamburg und Schleswig-Holstein prognostiziert.,Weather: Spring-like days in Hamburg and Schleswig-Holstein. Warm air from the southwest ensures moments of sunshine and up to 14 degrees - but one day brings surprisingly cool air and fog. What the weather service forecasts for Hamburg and Schleswig-Holstein.,Tempestas: dies vernum sicut in Hamburg et in Schleswig-Holstein. Aer calidus ab occasu brumali momenta solis et usque ad 14 gradus efficit - sed unus dies mire refrigerat aerem et nebulam. Quid tempestatis ministerium praesagium Hamburgum et Schleswig-Holstein.,2026-03-06 14:04:46+00:00
9da4438c50fe7e8a9e458b822e914eb4,2026-03-05T14:10:01Z,'Nebeltage',www.sueddeutsche.de,de,0.8,Wetter in Bayern: Der Süden versinkt im Nebel,"Jeden Morgen Nebel, im Donautal, im Isartal, im Lechtal. Vor allem die Niederbayern müssten in kollektive Depression versinken, kaum irgendwo sonst in Deutschland gibt es so viel Nebel. Aber das kann auch Gutes verheißen.",https://www.sueddeutsche.de/bayern/bayern-nebel-wetterphaenomene-freistaat-li.3447657,https://www.sueddeutsche.de/2026/02/19/4d34cd74-ebdd-43b4-b819-8448661a95bf.jpg?q=60&fm=webp&width=1200&rect=0%2C206%2C4000%2C2250,,"Wie schön wäre es jetzt in Lübeck statt in Regensburg, in Husum statt in Straubing, auch in Büsum statt im Lechfeld. Da könnte man aufstehen, aus dem Fenster blicken und höchstwahrscheinlich sogar et… [+2432 chars]",,"Wetter in Bayern: Der Süden versinkt im Nebel. Jeden Morgen Nebel, im Donautal, im Isartal, im Lechtal. Vor allem die Niederbayern müssten in kollektive Depression versinken, kaum irgendwo sonst in Deutschland gibt es so viel Nebel. Aber das kann auch Gutes verheißen.","Weather in Bavaria: The south is sinking into fog. Fog every morning, in the Danube Valley, in the Isar Valley, in the Lechtal. Lower Bavaria in particular would have to sink into collective depression; hardly anywhere else in Germany is there so much fog. But that can also bode well.","Tempestas in Bavaria: Meridies in nebula mergitur. Caligo omni mane, in valle Danubii, in valle Isar, in Lechtal. Bavariam inferiorem potissimum in depressionem collectivam haberent; vix alibi in Germania tanta nebula est. Sed id etiam bene coquere potest.",2026-03-06 19:51:43+00:00
91f6f74903b3ff311e8461ca8623e9e3,2026-03-07T06:40:21Z,'Nebel Wetter',www.stern.de,de,0.8,Wetter: Sonnig und milder Samstag in Bayern,"München (lby) - Leicht frostige Nächte, morgendlicher Nebel und tagsüber reichlich Sonnenschein und ein paar Wolken - so geht das Wetter in Bayern weiter.",https://www.stern.de/gesellschaft/regional/bayern/wetter--sonnig-und-milder-samstag-in-bayern-37199616.html,https://image.stern.de/37199618/t/GJ/v1/w1440/r1.7778/-/07--6xmndcycezv7axs2048jpeg---c8282c654538dea5.jpg,http://web.archive.org/web/20260307065059/https://www.stern.de/gesellschaft/regional/bayern/wetter--sonnig-und-milder-samstag-in-bayern-37199616.html,"Kopiere den aktuellen Link
Zur Merkliste hinzufügen
Auch wenn die Nächte teils noch winterlich kalt sind: Tagsüber gibt es im Freistaat weiterhin frühlingshaftes Wetter.
Leicht frostige Nächte, mo… [+1018 chars]",,"Wetter: Sonnig und milder Samstag in Bayern. München (lby) - Leicht frostige Nächte, morgendlicher Nebel und tagsüber reichlich Sonnenschein und ein paar Wolken - so geht das Wetter in Bayern weiter.","Weather: Sunny and mild Saturday in Bavaria. Munich (lby) - Slightly frosty nights, morning fog and plenty of sunshine and a few clouds during the day - this is how the weather in Bavaria continues.","Weather: Apricus et mitis Saturni in Bavaria. Munich (lby) - Leviter pruinae noctes, matutinae nebulae et soles copiae et interdiu paucae nubes — hoc modo tempestas in Bavaria continuatur.",2026-03-10 07:58:25+00:00
